{
  "version": 1,
  "revision": 4,
  "policy": {"subsection_titles":"author_only","speaker_labels":false,"source_boxes":false,"chapter_titles":"on_entry","archive":"immutable_source_blocks","origin":"authored","metadata":{"addition":true,"kind":"new_setting","status":"proposed","note":"추가: A/B 공용 독자 본문 편집 규칙. 원작 문자열·반영표·분기·상태는 보존하고 화자·행동·표지판 맥락을 판본별 서술로 연결한다. 경험치 숫자는 기록에 보존하며 본문에 상태창으로 출력하지 않는다."}},
  "groups": [
    {"node":"prologue/courtyard","block_ids":["prologue/guide_dialogue"],"kind":"speech","editions":{"A":{"before":[{"text":"안내인이 일행을 향해 말했다. "}],"after":[]},"B":{"before":[{"text":"안내인이 말했다. "}],"after":[]}},"provenance":{"origin":"authored","source_block_ids":["prologue/guide_dialogue"],"note":"추가: 발화나 글을 읽는 상황을 잇는 서술. 이름 없는 화자에게 고유 이름·직업·설정을 확정하지 않는다."}},
    {"node":"prologue/courtyard","block_ids":["i/threshold_before_assignment"],"kind":"speech","editions":{"A":{"before":[{"text":"문 앞에서도 같은 권유를 들었다. "}],"after":[]},"B":{"before":[{"text":"문 앞에서도 같은 권유를 들었다. "}],"after":[]}},"provenance":{"origin":"authored","source_block_ids":["i/threshold_before_assignment"],"note":"추가: 발화나 글을 읽는 상황을 잇는 서술. 이름 없는 화자에게 고유 이름·직업·설정을 확정하지 않는다."}},
    {"node":"prologue/tavern","block_ids":["prologue/veteran_dialogue"],"kind":"speech","editions":{"A":{"before":[{"text":"노인은 잔을 앞에 둔 채 이야기를 시작했다. "}],"after":[]},"B":{"before":[{"text":"노인의 말이 이어졌다. "}],"after":[]}},"provenance":{"origin":"authored","source_block_ids":["prologue/veteran_dialogue"],"note":"추가: 발화나 글을 읽는 상황을 잇는 서술. 이름 없는 화자에게 고유 이름·직업·설정을 확정하지 않는다."}},
    {"node":"prologue/audience","block_ids":["prologue/lord_intro_dialogue"],"kind":"speech","editions":{"A":{"before":[{"ref":{"catalog":"characters","id":"lord_ahn","particle":"은/는"}},{"text":" 일행에게 자신을 소개했다. "}],"after":[]},"B":{"before":[{"ref":{"catalog":"characters","id":"lord_ahn","particle":"은/는"}},{"text":" 입을 열었다. "}],"after":[]}},"provenance":{"origin":"authored","source_block_ids":["prologue/lord_intro_dialogue"],"note":"추가: 발화나 글을 읽는 상황을 잇는 서술. 이름 없는 화자에게 고유 이름·직업·설정을 확정하지 않는다."}},
    {"node":"prologue/briefing","block_ids":["prologue/lord_history_dialogue"],"kind":"speech","editions":{"A":{"before":[{"text":"성주는 자신이 기억하는 세계의 변화를 들려주었다. "}],"after":[]},"B":{"before":[{"text":"성주의 이야기가 이어졌다. "}],"after":[]}},"provenance":{"origin":"authored","source_block_ids":["prologue/lord_history_dialogue"],"note":"추가: 발화나 글을 읽는 상황을 잇는 서술. 이름 없는 화자에게 고유 이름·직업·설정을 확정하지 않는다."}},
    {"node":"lore_menace/assignment","block_ids":["lore_menace/request_quote"],"kind":"speech","editions":{"A":{"before":[{"text":"성주는 이번에는 일행이 가야 할 곳을 짚어 말했다. "}],"after":[]},"B":{"before":[{"text":"성주가 부탁을 꺼냈다. "}],"after":[]}},"provenance":{"origin":"authored","source_block_ids":["lore_menace/request_quote"],"note":"추가: 발화나 글을 읽는 상황을 잇는 서술. 이름 없는 화자에게 고유 이름·직업·설정을 확정하지 않는다."}},
    {"node":"lore_menace/preparation","block_ids":["i/guide_progress"],"kind":"speech","editions":{"A":{"before":[{"text":"안내인은 떠날 채비를 하는 일행에게 인사를 건넸다. "}],"after":[]},"B":{"before":[{"text":"안내인이 배웅했다. "}],"after":[]}},"provenance":{"origin":"authored","source_block_ids":["i/guide_progress"],"note":"추가: 발화나 글을 읽는 상황을 잇는 서술. 이름 없는 화자에게 고유 이름·직업·설정을 확정하지 않는다."}},
    {"node":"lore_menace/reminder","block_ids":["lore_menace/reminder_quote"],"kind":"speech","editions":{"A":{"before":[{"text":"성주는 목적지를 다시 일러 주었다. "}],"after":[]},"B":{"before":[{"text":"성주는 목적지를 다시 일러 주었다. "}],"after":[]}},"provenance":{"origin":"authored","source_block_ids":["lore_menace/reminder_quote"],"note":"추가: 발화나 글을 읽는 상황을 잇는 서술. 이름 없는 화자에게 고유 이름·직업·설정을 확정하지 않는다."}},
    {"node":"lore_menace/castle_exit","block_ids":["lore_menace/exit_call_quote"],"kind":"narration","editions":{"A":{"before":[],"after":[],"body":[{"ref":{"catalog":"terms","id":"lore"}},{"text":" 성을 떠나려는 순간, 뒤쪽에서 누군가 "},{"ref":{"catalog":"characters","id":"protagonist","particle":"을/를"}},{"text":" 불렀다."}]},"B":{"before":[],"after":[],"body":[{"ref":{"catalog":"terms","id":"lore"}},{"text":" 성을 떠나려는 순간, 뒤쪽에서 누군가 "},{"ref":{"catalog":"characters","id":"protagonist","particle":"을/를"}},{"text":" 불렀다."}]}},"provenance":{"origin":"source_adaptation","source_block_ids":["lore_menace/exit_call_quote"],"note":"각색: 원문 출력의 사건·결과를 소설 서술로 옮긴다. 보존 문자열·원문 반영 ID·분기 상태는 바꾸지 않는다."}},
    {"node":"lore_menace/castle_exit","block_ids":["lore_menace/skeleton_quote"],"kind":"speech","editions":{"A":{"before":[{"text":"그는 일행 앞에 멈춰 서서 자신이 찾아온 까닭을 말했다. "}],"after":[]},"B":{"before":[{"text":"낯선 이가 자신을 소개했다. "}],"after":[]}},"provenance":{"origin":"authored","source_block_ids":["lore_menace/skeleton_quote"],"note":"추가: 발화나 글을 읽는 상황을 잇는 서술. 이름 없는 화자에게 고유 이름·직업·설정을 확정하지 않는다."}},
    {"node":"lore_menace/center","block_ids":["lore_menace/center_quote"],"kind":"narration","editions":{"A":{"before":[],"after":[],"body":[{"text":"여기가 "},{"ref":{"catalog":"terms","id":"menace"}},{"text":"의 중심이었다. 맡은 탐사는 끝났다. 이제 "},{"ref":{"catalog":"characters","id":"lord_ahn"}},{"text":"에게 돌아가 본 것을 보고해야 했다."}]},"B":{"before":[],"after":[],"body":[{"text":"여기가 "},{"ref":{"catalog":"terms","id":"menace"}},{"text":"의 중심이었다. 맡은 탐사는 끝났다. 이제 "},{"ref":{"catalog":"characters","id":"lord_ahn"}},{"text":"에게 돌아가 본 것을 보고해야 했다."}]}},"provenance":{"origin":"source_adaptation","source_block_ids":["lore_menace/center_quote"],"note":"각색: 원문 출력의 사건·결과를 소설 서술로 옮긴다. 보존 문자열·원문 반영 ID·분기 상태는 바꾸지 않는다."}},
    {"node":"lore_menace/report","block_ids":["lore_menace/report_quote"],"kind":"speech","editions":{"A":{"before":[{"text":"성주는 돌아온 일행을 맞아 말했다. "}],"after":[]},"B":{"before":[{"text":"성주가 일행의 귀환을 반겼다. "}],"after":[]}},"provenance":{"origin":"authored","source_block_ids":["lore_menace/report_quote"],"note":"추가: 발화나 글을 읽는 상황을 잇는 서술. 이름 없는 화자에게 고유 이름·직업·설정을 확정하지 않는다."}},
    {"node":"lore_menace/report","block_ids":["lore_menace/reward_counter_quote"],"kind":"narration","editions":{"A":{"before":[],"after":[],"body":[{"text":"성주는 일행이 탐사를 마치고 돌아온 공로를 인정했다."}]},"B":{"before":[],"after":[],"body":[{"text":"탐사를 끝낸 공로를 인정받았다."}]}},"provenance":{"origin":"source_adaptation","source_block_ids":["lore_menace/reward_counter_quote"],"note":"각색: 원문 출력의 사건·결과를 소설 서술로 옮긴다. 보존 문자열·원문 반영 ID·분기 상태는 바꾸지 않는다."}},
    {"node":"lore_menace/next_task","block_ids":["lore_menace/next_quote"],"kind":"speech","editions":{"A":{"before":[{"text":"축하가 끝난 뒤, 성주는 다음 부탁을 꺼냈다. "}],"after":[]},"B":{"before":[{"text":"성주의 말은 다음 부탁으로 이어졌다. "}],"after":[]}},"provenance":{"origin":"authored","source_block_ids":["lore_menace/next_quote"],"note":"추가: 발화나 글을 읽는 상황을 잇는 서술. 이름 없는 화자에게 고유 이름·직업·설정을 확정하지 않는다."}},
    {"node":"lore_menace/farewell","block_ids":["lore_menace/farewell_quote"],"kind":"speech","editions":{"A":{"before":[{"text":"성주는 떠나는 일행에게 마지막 말을 건넸다. "}],"after":[]},"B":{"before":[{"text":"성주는 떠나는 일행에게 마지막 말을 건넸다. "}],"after":[]}},"provenance":{"origin":"authored","source_block_ids":["lore_menace/farewell_quote"],"note":"추가: 발화나 글을 읽는 상황을 잇는 서술. 이름 없는 화자에게 고유 이름·직업·설정을 확정하지 않는다."}},
    {"node":"i/armory","block_ids":["i/armory_permission"],"kind":"speech","editions":{"A":{"before":[{"text":"무기고를 지키는 사람이 안쪽을 가리키며 말했다. "}],"after":[]},"B":{"before":[{"text":"무기고를 지키던 사람이 안쪽을 가리켰다. "}],"after":[]}},"provenance":{"origin":"authored","source_block_ids":["i/armory_permission"],"note":"추가: 발화나 글을 읽는 상황을 잇는 서술. 이름 없는 화자에게 고유 이름·직업·설정을 확정하지 않는다. B 1장 3차 편집: 발화 주체·습득 과정과 다음 행동을 연결한 미승인 각색. 보존 원문과 사건 효과는 유지한다."}},
    {"node":"i/armory","block_ids":["i/armory_processed"],"kind":"narration","editions":{"A":{"before":[],"after":[],"body":[{"text":"일행은 저마다 기본적인 무기를 갖추었다."}]},"B":{"before":[],"after":[],"body":[{"text":"일행은 각자 쓸 무기를 갖췄다. 이미 가져온 도구가 있는 사람은 바꾸기보다 손에 맞게 정리했다."}]}},"provenance":{"origin":"source_adaptation","source_block_ids":["i/armory_processed"],"note":"각색: 원문 출력의 사건·결과를 소설 서술로 옮긴다. 보존 문자열·원문 반영 ID·분기 상태는 바꾸지 않는다. B 1장 3차 편집: 발화 주체·습득 과정과 다음 행동을 연결한 미승인 각색. 보존 원문과 사건 효과는 유지한다."}},
    {"node":"i/streets","block_ids":["i/venom"],"kind":"speech","editions":{"A":{"before":[{"text":"길에서 만난 사람이 모험길의 위험을 경고했다. "}],"after":[]},"B":{"before":[{"text":"길에서 경고를 들었다. "}],"after":[]}},"provenance":{"origin":"authored","source_block_ids":["i/venom"],"note":"추가: 발화나 글을 읽는 상황을 잇는 서술. 이름 없는 화자에게 고유 이름·직업·설정을 확정하지 않는다."}},
    {"node":"i/streets","block_ids":["i/orc"],"kind":"speech","editions":{"A":{"before":[{"text":"곁에서 듣던 사람이 괴물 이야기를 보탰다. "}],"after":[]},"B":{"before":[{"text":"다른 목소리가 말을 보탰다. "}],"after":[]}},"provenance":{"origin":"authored","source_block_ids":["i/orc"],"note":"추가: 발화나 글을 읽는 상황을 잇는 서술. 이름 없는 화자에게 고유 이름·직업·설정을 확정하지 않는다."}},
    {"node":"i/streets","block_ids":["i/pyramid_hint"],"kind":"speech","editions":{"A":{"before":[{"text":"또 다른 이는 성 위쪽의 피라밋을 가리키며 말했다. "}],"after":[]},"B":{"before":[{"text":"이번에는 피라밋 이야기가 나왔다. "}],"after":[]}},"provenance":{"origin":"authored","source_block_ids":["i/pyramid_hint"],"note":"추가: 발화나 글을 읽는 상황을 잇는 서술. 이름 없는 화자에게 고유 이름·직업·설정을 확정하지 않는다."}},
    {"node":"i/streets","block_ids":["i/venom_loss"],"kind":"speech","editions":{"A":{"before":[{"text":"독 이야기에 한 사람이 자기 가족의 일을 꺼냈다. "}],"after":[]},"B":{"before":[{"text":"한 사람은 자기 가족을 떠올렸다. "}],"after":[]}},"provenance":{"origin":"authored","source_block_ids":["i/venom_loss"],"note":"추가: 발화나 글을 읽는 상황을 잇는 서술. 이름 없는 화자에게 고유 이름·직업·설정을 확정하지 않는다."}},
    {"node":"i/streets","block_ids":["i/lord_rumor"],"kind":"speech","editions":{"A":{"before":[{"text":"성주의 이름이 나오자 다른 사람이 자기 생각을 말했다. "}],"after":[]},"B":{"before":[{"text":"성주에 관한 말도 들었다. "}],"after":[]}},"provenance":{"origin":"authored","source_block_ids":["i/lord_rumor"],"note":"추가: 발화나 글을 읽는 상황을 잇는 서술. 이름 없는 화자에게 고유 이름·직업·설정을 확정하지 않는다."}},
    {"node":"i/streets","block_ids":["i/loyalty"],"kind":"speech","editions":{"A":{"before":[{"text":"성주를 받들어야 한다는 목소리도 들렸다. "}],"after":[]},"B":{"before":[{"text":"성주를 받들어야 한다는 말이 뒤따랐다. "}],"after":[]}},"provenance":{"origin":"authored","source_block_ids":["i/loyalty"],"note":"추가: 발화나 글을 읽는 상황을 잇는 서술. 이름 없는 화자에게 고유 이름·직업·설정을 확정하지 않는다."}},